[command: timedatectl set-ntp no]

[command: cat /proc/driver/rtc]

[command: cat /proc/driver/rtc]

[command: dmidecode -t 4]

# dmidecode 3.2
Getting SMBIOS data from sysfs.
SMBIOS 3.2.0 present.

Handle 0x000C, DMI type 4, 48 bytes
Processor Information
	Socket Designation: CPU0
	Type: Central Processor
	Family: ARM
	Manufacturer: HISILICON
	ID: 50 D0 1F 41 00 00 00 00
	Signature: Implementor 0x41, Variant 0x1, Architecture 15, Part 0xd05, Revision 0
	Version: HUAWEI Kirin990
	Voltage: 1.8 V
	External Clock: 38 MHz
	Max Speed: 2860 MHz
	Current Speed: 2860 MHz
	Status: Populated, Enabled
	Upgrade: Unknown
	L1 Cache Handle: 0x0009
	L2 Cache Handle: 0x000A
	L3 Cache Handle: 0x000B
	Serial Number: NULL
	Asset Tag: NULL
	Part Number: NULL
	Core Count: 2
	Core Enabled: 2
	Thread Count: 2
	Characteristics:
		64-bit capable
		Multi-Core
		Execute Protection
		Power/Performance Control

Handle 0x000D, DMI type 4, 48 bytes
Processor Information
	Socket Designation: CPU0
	Type: Central Processor
	Family: ARM
	Manufacturer: HISILICON
	ID: 50 D0 1F 41 00 00 00 00
	Signature: Implementor 0x41, Variant 0x1, Architecture 15, Part 0xd05, Revision 0
	Version: HUAWEI Kirin990
	Voltage: 1.8 V
	External Clock: 38 MHz
	Max Speed: 2360 MHz
	Current Speed: 2360 MHz
	Status: Populated, Enabled
	Upgrade: Unknown
	L1 Cache Handle: 0x0009
	L2 Cache Handle: 0x000A
	L3 Cache Handle: 0x000B
	Serial Number: NULL
	Asset Tag: NULL
	Part Number: NULL
	Core Count: 2
	Core Enabled: 2
	Thread Count: 2
	Characteristics:
		64-bit capable
		Multi-Core
		Execute Protection
		Power/Performance Control

Handle 0x000E, DMI type 4, 48 bytes
Processor Information
	Socket Designation: CPU0
	Type: Central Processor
	Family: ARM
	Manufacturer: HISILICON
	ID: 50 D0 1F 41 00 00 00 00
	Signature: Implementor 0x41, Variant 0x1, Architecture 15, Part 0xd05, Revision 0
	Version: HUAWEI Kirin990
	Voltage: 1.8 V
	External Clock: 38 MHz
	Max Speed: 1950 MHz
	Current Speed: 1950 MHz
	Status: Populated, Enabled
	Upgrade: Unknown
	L1 Cache Handle: 0x0009
	L2 Cache Handle: 0x000A
	L3 Cache Handle: 0x000B
	Serial Number: NULL
	Asset Tag: NULL
	Part Number: NULL
	Core Count: 4
	Core Enabled: 4
	Thread Count: 4
	Characteristics:
		64-bit capable
		Multi-Core
		Execute Protection
		Power/Performance Control

[command: cd tools && sh stress.sh]

[command: stress -c 8 -t 10]

[command: cd tools && sh rasdaemon.sh]

[command: ras-mc-ctl --summary]

[command: smartctl -a /dev/sde]

smartctl 6.6 2017-11-05 r4594 [aarch64-linux-4.19.71-arm64-desktop] (local build)
Copyright (C) 2002-17, Bruce Allen, Christian Franke, www.smartmontools.org

=== START OF INFORMATION SECTION ===
Model Family:     Seagate Barracuda 3.5
Device Model:     ST1000DM010-2EP102
Serial Number:    ZN1Q484R
LU WWN Device Id: 5 000c50 0db4aebd3
Firmware Version: CC46
User Capacity:    1,000,204,886,016 bytes [1.00 TB]
Sector Sizes:     512 bytes logical, 4096 bytes physical
Rotation Rate:    7200 rpm
Form Factor:      3.5 inches
Device is:        In smartctl database [for details use: -P show]
ATA Version is:   ATA8-ACS T13/1699-D revision 4
SATA Version is:  SATA 3.0, 6.0 Gb/s (current: 6.0 Gb/s)
Local Time is:    Wed Dec 15 11:41:05 2021 CST
SMART support is: Available - device has SMART capability.
SMART support is: Enabled

=== START OF READ SMART DATA SECTION ===
SMART overall-health self-assessment test result: PASSED

General SMART Values:
Offline data collection status:  (0x82)	Offline data collection activity
					was completed without error.
					Auto Offline Data Collection: Enabled.
Self-test execution status:      (   0)	The previous self-test routine completed
					without error or no self-test has ever 
					been run.
Total time to complete Offline 
data collection: 		(    0) seconds.
Offline data collection
capabilities: 			 (0x7b) SMART execute Offline immediate.
					Auto Offline data collection on/off support.
					Suspend Offline collection upon new
					command.
					Offline surface scan supported.
					Self-test supported.
					Conveyance Self-test supported.
					Selective Self-test supported.
SMART capabilities:            (0x0003)	Saves SMART data before entering
					power-saving mode.
					Supports SMART auto save timer.
Error logging capability:        (0x01)	Error logging supported.
					General Purpose Logging supported.
Short self-test routine 
recommended polling time: 	 (   1) minutes.
Extended self-test routine
recommended polling time: 	 ( 108) minutes.
Conveyance self-test routine
recommended polling time: 	 (   2) minutes.
SCT capabilities: 	       (0x1085)	SCT Status supported.

SMART Attributes Data Structure revision number: 10
Vendor Specific SMART Attributes with Thresholds:
ID# ATTRIBUTE_NAME          FLAG     VALUE WORST THRESH TYPE      UPDATED  WHEN_FAILED RAW_VALUE
  1 Raw_Read_Error_Rate     0x000f   075   065   006    Pre-fail  Always       -       35679866
  3 Spin_Up_Time            0x0003   097   097   000    Pre-fail  Always       -       0
  4 Start_Stop_Count        0x0032   100   100   020    Old_age   Always       -       48
  5 Reallocated_Sector_Ct   0x0033   100   100   010    Pre-fail  Always       -       0
  7 Seek_Error_Rate         0x000f   100   253   045    Pre-fail  Always       -       75668
  9 Power_On_Hours          0x0032   100   100   000    Old_age   Always       -       268
 10 Spin_Retry_Count        0x0013   100   100   097    Pre-fail  Always       -       0
 12 Power_Cycle_Count       0x0032   100   100   020    Old_age   Always       -       36
183 Runtime_Bad_Block       0x0032   100   100   000    Old_age   Always       -       0
184 End-to-End_Error        0x0032   100   100   099    Old_age   Always       -       0
187 Reported_Uncorrect      0x0032   100   100   000    Old_age   Always       -       0
188 Command_Timeout         0x0032   100   100   000    Old_age   Always       -       0 0 0
189 High_Fly_Writes         0x003a   100   100   000    Old_age   Always       -       0
190 Airflow_Temperature_Cel 0x0022   063   057   040    Old_age   Always       -       37 (Min/Max 35/39)
193 Load_Cycle_Count        0x0032   100   100   000    Old_age   Always       -       52
194 Temperature_Celsius     0x0022   037   020   000    Old_age   Always       -       37 (0 20 0 0 0)
195 Hardware_ECC_Recovered  0x001a   008   008   000    Old_age   Always       -       35679866
197 Current_Pending_Sector  0x0012   100   100   000    Old_age   Always       -       0
198 Offline_Uncorrectable   0x0010   100   100   000    Old_age   Offline      -       0
199 UDMA_CRC_Error_Count    0x003e   200   200   000    Old_age   Always       -       0
240 Head_Flying_Hours       0x0000   100   253   000    Old_age   Offline      -       203h+49m+46.628s
241 Total_LBAs_Written      0x0000   100   253   000    Old_age   Offline      -       32667398
242 Total_LBAs_Read         0x0000   100   253   000    Old_age   Offline      -       3012468

SMART Error Log Version: 1
No Errors Logged

SMART Self-test log structure revision number 1
No self-tests have been logged.  [To run self-tests, use: smartctl -t]

SMART Selective self-test log data structure revision number 1
 SPAN  MIN_LBA  MAX_LBA  CURRENT_TEST_STATUS
    1        0        0  Not_testing
    2        0        0  Not_testing
    3        0        0  Not_testing
    4        0        0  Not_testing
    5        0        0  Not_testing
Selective self-test flags (0x0):
  After scanning selected spans, do NOT read-scan remainder of disk.
If Selective self-test is pending on power-up, resume after 0 minute delay.

[command: dmesg | grep -i warn]

[   14.198394] [pid:1,cpu0,swapper/0,3]WARNING: CPU: 0 PID: 1 at kernel/sched/walt.c:536 walt_update_task_ravg.part.7+0x498/0xc18
[   14.207824] [pid:1,cpu0,swapper/0,3]WARNING: CPU: 0 PID: 1 at arch/arm64/kernel/smp.c:422 smp_cpus_done+0x70/0x94
[command: ifconfig]

enxdc333d0aa3fa: flags=4099<UP,BROADCAST,MULTICAST>  mtu 1500
        ether dc:33:3d:0a:a3:fa  txqueuelen 1000  (Ethernet)
        RX packets 0  bytes 0 (0.0 B)
        RX errors 0  dropped 0  overruns 0  frame 0
        TX packets 0  bytes 0 (0.0 B)
        TX errors 0  dropped 0 overruns 0  carrier 0  collisions 0

lo: flags=73<UP,LOOPBACK,RUNNING>  mtu 65536
        inet 127.0.0.1  netmask 255.0.0.0
        inet6 ::1  prefixlen 128  scopeid 0x10<host>
        loop  txqueuelen 1000  (Local Loopback)
        RX packets 10950  bytes 1123459 (1.0 MiB)
        RX errors 0  dropped 0  overruns 0  frame 0
        TX packets 10950  bytes 1123459 (1.0 MiB)
        TX errors 0  dropped 0 overruns 0  carrier 0  collisions 0

wlan0: flags=4163<UP,BROADCAST,RUNNING,MULTICAST>  mtu 1500
        inet 192.168.188.50  netmask 255.255.255.0  broadcast 192.168.188.255
        inet6 fe80::8a24:caa:ae77:85ae  prefixlen 64  scopeid 0x20<link>
        ether dc:33:3d:0a:ab:17  txqueuelen 1000  (Ethernet)
        RX packets 929750  bytes 811794440 (774.1 MiB)
        RX errors 0  dropped 0  overruns 0  frame 0
        TX packets 296898  bytes 35966084 (34.2 MiB)
        TX errors 0  dropped 0 overruns 0  carrier 0  collisions 0

