Scan sn is: 123456
Input operator is: 123456
===================================
STATION_FUNC 2021-12-15 13:53:34
===================================
======== RTC_CHECK 2021-12-15 13:53:34========

[command: timedatectl set-ntp no]
>> set_datetimetest is success!
[command: cat /proc/driver/rtc]
rtc_time	: 05:53:35
rtc_date	: 2021-12-15
24hr		: yes
[command: cat /proc/driver/rtc]
rtc_time	: 05:53:41
rtc_date	: 2021-12-15
24hr		: yes
>> precision_checktest is success!
======== RTC_CHECK PASS  2021-12-15 13:53:41========

======== INFO_PROGRAMMING 2021-12-15 13:53:41========

======== INFO_PROGRAMMING PASS  2021-12-15 13:53:46========

======== HOST_CFG_SET 2021-12-15 13:53:46========

======== HOST_CFG_SET PASS  2021-12-15 13:53:51========

======== CPU_CHECK 2021-12-15 13:53:51========

[command: dmidecode -t 4]
Socket Designation: CPU0
Socket Designation: CPU0
Socket Designation: CPU0
>>> 1
Core Count: 2
Core Count: 2
Core Count: 4
>>> 8
Version: HUAWEI Kirin990
Version: HUAWEI Kirin990
Version: HUAWEI Kirin990
>>> HUAWEI Kirin990
Current Speed: 2860 MHz
Current Speed: 2360 MHz
Current Speed: 1950 MHz
>>> 2860 MHz
>>> 2360 MHz
>>> 1950 MHz
[command: cd tools && sh stress.sh]
[command: stress -c 8 -t 10]
========  CPU的负载测试 ========
stress: info: [11233] dispatching hogs: 8 cpu, 0 io, 0 vm, 0 hdd
stress: info: [11233] successful run completed in 10s
================================
>> cpu_loading_checktest is success!
[command: cd tools && sh rasdaemon.sh]
[command: ras-mc-ctl --summary]
========  CPU MCE检测 ===========
No Memory errors.

No PCIe AER errors.

No Extlog errors.
No MCE errors.
================================
>> cpu_mce_checktest is success!
======== DISK_CHECK 2021-12-15 13:54:09========

[command: sudo smartctl -a /dev/sde]
Device Model:     ST1000DM010-2EP102
>>> ST1000DM010-2EP102
[command: sudo smartctl -i /dev/sdd]
Vendor:               SKhynix
Product:              HN8T15BZGKX016
>>> SKhynix
>>> HN8T15BZGKX016
[command: cd tools && sh fio.sh]
正在读取软件包列表...
正在分析软件包的依赖关系树...
正在读取状态信息...
下列软件包是自动安装的并且现在不需要了：
  gir1.2-harfbuzz-0.0 golang-gir-gio-2.0-dev golang-gir-glib-2.0-dev
  golang-gir-gobject-2.0-dev golang-github-cryptix-wav-dev
  golang-github-gavv-monotime-dev golang-github-kr-pretty-dev
  golang-github-kr-pty-dev golang-github-kr-text-dev
  golang-github-linuxdeepin-go-x11-client-dev
  golang-github-mozillazg-go-pinyin-dev golang-golang-x-image-dev
  golang-golang-x-net-dev golang-golang-x-text-dev golang-golang-x-tools-dev
  golang-gopkg-check.v1-dev libatk-bridge2.0-dev libatk1.0-dev libatspi2.0-dev
  libcairo-script-interpreter2 libepoxy-dev libexpat1-dev libfribidi-dev
  libgraphite2-dev libharfbuzz-dev libharfbuzz-gobject0 libpam0g-dev
  libpixman-1-dev libxcb-shm0-dev libxcomposite-dev libxtst-dev pango1.0-tools
  wayland-protocols x11proto-composite-dev x11proto-record-dev
使用'sudo apt autoremove'来卸载它(它们)。
建议安装：
  gnuplot gfio python-scipy
下列【新】软件包将被安装：
  fio
升级了 0 个软件包，新安装了 1 个软件包，要卸载 0 个软件包，有 53 个软件包未被升级。
需要下载 0 B/473 kB 的归档。
解压缩后会消耗 1,860 kB 的额外空间。
正在选中未选择的软件包 fio。
(正在读取数据库 ... (正在读取数据库 ... 5%(正在读取数据库 ... 10%(正在读取数据库 ... 15%(正在读取数据库 ... 20%(正在读取数据库 ... 25%(正在读取数据库 ... 30%(正在读取数据库 ... 35%(正在读取数据库 ... 40%(正在读取数据库 ... 45%(正在读取数据库 ... 50%(正在读取数据库 ... 55%(正在读取数据库 ... 60%(正在读取数据库 ... 65%(正在读取数据库 ... 70%(正在读取数据库 ... 75%(正在读取数据库 ... 80%(正在读取数据库 ... 85%(正在读取数据库 ... 90%(正在读取数据库 ... 95%(正在读取数据库 ... 100%(正在读取数据库 ... 系统当前共安装有 231986 个文件和目录。)
准备解压 .../archives/fio_3.12-2_arm64.deb  ...
正在解压 fio (3.12-2) ...
正在设置 fio (3.12-2) ...
正在处理用于 man-db (2.8.5-2) 的触发器 ...
fio安装成功！
 
[ sudo fio -filename=/dev/sde -direct=1 -iodepth 1 -thread -rw=randread -ioengine=psync -bs=16k -size=2G-numjobs=10 -runtime=10 -group_reporting -name=mytest ]
mytest: (g=0): rw=randread, bs=(R) 16.0KiB-16.0KiB, (W) 16.0KiB-16.0KiB, (T) 16.0KiB-16.0KiB, ioengine=psync, iodepth=1
fio-3.12
Starting 1 thread

mytest: (groupid=0, jobs=1): err= 0: pid=12065: Wed Dec 15 13:54:22 2021
  read: IOPS=68, BW=1098KiB/s (1124kB/s)(5504KiB/5013msec)
    clat (usec): min=4758, max=26660, avg=14560.96, stdev=4237.60
     lat (usec): min=4759, max=26660, avg=14561.59, stdev=4237.58
    clat percentiles (usec):
     |  1.00th=[ 5932],  5.00th=[ 7701], 10.00th=[ 9241], 20.00th=[10814],
     | 30.00th=[11994], 40.00th=[13304], 50.00th=[14353], 60.00th=[15795],
     | 70.00th=[16909], 80.00th=[18220], 90.00th=[20317], 95.00th=[21890],
     | 99.00th=[23200], 99.50th=[25822], 99.90th=[26608], 99.95th=[26608],
     | 99.99th=[26608]
   bw (  KiB/s): min= 1024, max= 1213, per=100.00%, avg=1097.00, stdev=66.86, samples=10
   iops        : min=   64, max=   75, avg=68.40, stdev= 4.01, samples=10
  lat (msec)   : 10=15.12%, 20=74.13%, 50=10.76%
  cpu          : usr=0.00%, sys=0.34%, ctx=345, majf=0, minf=4
  IO depths    : 1=100.0%, 2=0.0%, 4=0.0%, 8=0.0%, 16=0.0%, 32=0.0%, >=64=0.0%
     submit    : 0=0.0%, 4=100.0%, 8=0.0%, 16=0.0%, 32=0.0%, 64=0.0%, >=64=0.0%
     complete  : 0=0.0%, 4=100.0%, 8=0.0%, 16=0.0%, 32=0.0%, 64=0.0%, >=64=0.0%
     issued rwts: total=344,0,0,0 short=0,0,0,0 dropped=0,0,0,0
     latency   : target=0, window=0, percentile=100.00%, depth=1

Run status group 0 (all jobs):
   READ: bw=1098KiB/s (1124kB/s), 1098KiB/s-1098KiB/s (1124kB/s-1124kB/s), io=5504KiB (5636kB), run=5013-5013msec

Disk stats (read/write):
  sde: ios=335/0, merge=0/0, ticks=4857/0, in_queue=4872, util=97.65%
[command: cd tools && sh smartctl.sh]
smartctl已经安装！
 
[ sudo smartctl --all /dev/sde ]
smartctl 6.6 2017-11-05 r4594 [aarch64-linux-4.19.71-arm64-desktop] (local build)
Copyright (C) 2002-17, Bruce Allen, Christian Franke, www.smartmontools.org

=== START OF INFORMATION SECTION ===
Model Family:     Seagate Barracuda 3.5
Device Model:     ST1000DM010-2EP102
Serial Number:    ZN1Q484R
LU WWN Device Id: 5 000c50 0db4aebd3
Firmware Version: CC46
User Capacity:    1,000,204,886,016 bytes [1.00 TB]
Sector Sizes:     512 bytes logical, 4096 bytes physical
Rotation Rate:    7200 rpm
Form Factor:      3.5 inches
Device is:        In smartctl database [for details use: -P show]
ATA Version is:   ATA8-ACS T13/1699-D revision 4
SATA Version is:  SATA 3.0, 6.0 Gb/s (current: 6.0 Gb/s)
Local Time is:    Wed Dec 15 13:54:22 2021 CST
SMART support is: Available - device has SMART capability.
SMART support is: Enabled

=== START OF READ SMART DATA SECTION ===
SMART overall-health self-assessment test result: PASSED

General SMART Values:
Offline data collection status:  (0x82)	Offline data collection activity
					was completed without error.
					Auto Offline Data Collection: Enabled.
Self-test execution status:      (   0)	The previous self-test routine completed
					without error or no self-test has ever 
					been run.
Total time to complete Offline 
data collection: 		(    0) seconds.
Offline data collection
capabilities: 			 (0x7b) SMART execute Offline immediate.
					Auto Offline data collection on/off support.
					Suspend Offline collection upon new
					command.
					Offline surface scan supported.
					Self-test supported.
					Conveyance Self-test supported.
					Selective Self-test supported.
SMART capabilities:            (0x0003)	Saves SMART data before entering
					power-saving mode.
					Supports SMART auto save timer.
Error logging capability:        (0x01)	Error logging supported.
					General Purpose Logging supported.
Short self-test routine 
recommended polling time: 	 (   1) minutes.
Extended self-test routine
recommended polling time: 	 ( 108) minutes.
Conveyance self-test routine
recommended polling time: 	 (   2) minutes.
SCT capabilities: 	       (0x1085)	SCT Status supported.

SMART Attributes Data Structure revision number: 10
Vendor Specific SMART Attributes with Thresholds:
ID# ATTRIBUTE_NAME          FLAG     VALUE WORST THRESH TYPE      UPDATED  WHEN_FAILED RAW_VALUE
  1 Raw_Read_Error_Rate     0x000f   075   065   006    Pre-fail  Always       -       35723898
  3 Spin_Up_Time            0x0003   097   097   000    Pre-fail  Always       -       0
  4 Start_Stop_Count        0x0032   100   100   020    Old_age   Always       -       48
  5 Reallocated_Sector_Ct   0x0033   100   100   010    Pre-fail  Always       -       0
  7 Seek_Error_Rate         0x000f   100   253   045    Pre-fail  Always       -       77055
  9 Power_On_Hours          0x0032   100   100   000    Old_age   Always       -       270
 10 Spin_Retry_Count        0x0013   100   100   097    Pre-fail  Always       -       0
 12 Power_Cycle_Count       0x0032   100   100   020    Old_age   Always       -       36
183 Runtime_Bad_Block       0x0032   100   100   000    Old_age   Always       -       0
184 End-to-End_Error        0x0032   100   100   099    Old_age   Always       -       0
187 Reported_Uncorrect      0x0032   100   100   000    Old_age   Always       -       0
188 Command_Timeout         0x0032   100   100   000    Old_age   Always       -       0 0 0
189 High_Fly_Writes         0x003a   100   100   000    Old_age   Always       -       0
190 Airflow_Temperature_Cel 0x0022   062   057   040    Old_age   Always       -       38 (Min/Max 35/39)
193 Load_Cycle_Count        0x0032   100   100   000    Old_age   Always       -       52
194 Temperature_Celsius     0x0022   038   020   000    Old_age   Always       -       38 (0 20 0 0 0)
195 Hardware_ECC_Recovered  0x001a   008   008   000    Old_age   Always       -       35723898
197 Current_Pending_Sector  0x0012   100   100   000    Old_age   Always       -       0
198 Offline_Uncorrectable   0x0010   100   100   000    Old_age   Offline      -       0
199 UDMA_CRC_Error_Count    0x003e   200   200   000    Old_age   Always       -       0
240 Head_Flying_Hours       0x0000   100   253   000    Old_age   Offline      -       206h+03m+03.623s
241 Total_LBAs_Written      0x0000   100   253   000    Old_age   Offline      -       32667398
242 Total_LBAs_Read         0x0000   100   253   000    Old_age   Offline      -       3056500

SMART Error Log Version: 1
No Errors Logged

SMART Self-test log structure revision number 1
No self-tests have been logged.  [To run self-tests, use: smartctl -t]

SMART Selective self-test log data structure revision number 1
 SPAN  MIN_LBA  MAX_LBA  CURRENT_TEST_STATUS
    1        0        0  Not_testing
    2        0        0  Not_testing
    3        0        0  Not_testing
    4        0        0  Not_testing
    5        0        0  Not_testing
Selective self-test flags (0x0):
  After scanning selected spans, do NOT read-scan remainder of disk.
If Selective self-test is pending on power-up, resume after 0 minute delay.

[command: cd tools && transducer.sh]
======== VENEER_HEALTH_CHECK 2021-12-15 13:54:23========

[command: dmesg | grep -i warn]
[   14.198394] [pid:1,cpu0,swapper/0,3]WARNING: CPU: 0 PID: 1 at kernel/sched/walt.c:536 walt_update_task_ravg.part.7+0x498/0xc18
[   14.207824] [pid:1,cpu0,swapper/0,3]WARNING: CPU: 0 PID: 1 at arch/arm64/kernel/smp.c:422 smp_cpus_done+0x70/0x94
>> veneer_checktest is fail!
======== MAC_ADDRESS_CHECK 2021-12-15 13:54:23========

[command: ifconfig]
>> mac_checktest is fail!
===============================================
STATION_FUNC PASS 2021-12-15 13:54:23
===============================================

===================================
STATION_STRESS 2021-12-15 13:54:23
===================================
======== ELECTRONIC_TAG_CHECK 2021-12-15 13:54:23========

======== ELECTRONIC_TAG_CHECK PASS  2021-12-15 13:54:28========

======== FW_CHECK 2021-12-15 13:54:28========

======== FW_CHECK PASS  2021-12-15 13:54:33========

===============================================
STATION_STRESS PASS 2021-12-15 13:54:33
===============================================

===================================
STATION_FINAL 2021-12-15 13:54:33
===================================
======== LOG_CLEAN_TEST 2021-12-15 13:54:33========

======== LOG_CLEAN_TEST PASS  2021-12-15 13:54:38========

===============================================
STATION_FINAL PASS 2021-12-15 13:54:38
===============================================

